{
    "id":  "2.2.1",
    "createdAt":  "2025-04-17T10:04:14.4078494+02:00",
    "metadata":  {
                     "estimatedHours":  24,
                     "completionDate":  "2025-04-17T00:00:00.0000000",
                     "progress":  100,
                     "owner":  "EMAIL_SENDER_1 Team",
                     "complexity":  3
                 },
    "description":  "",
    "tags":  [

             ],
    "updatedAt":  "2025-04-17T10:04:14.4078494+02:00",
    "status":  "Completed",
    "title":  "",
    "parentId":  "2.2",
    "files":  [

              ]
}
