{
    "id":  "1.1.2.6",
    "title":  "AmÃ©lioration des scripts MCP et rÃ©solution des notifications d\u0027erreur",
    "status":  "Completed",
    "createdAt":  "2025-04-16T19:50:07.1977328Z",
    "updatedAt":  "2025-04-16T19:50:07.1977328Z",
    "metadata":  {
                     "complexity":  3,
                     "estimatedHours":  16,
                     "progress":  100,
                     "dueDate":  null,
                     "startDate":  "2025-04-16T00:00:00.0000000",
                     "completionDate":  null,
                     "owner":  ""
                 },
    "description":  "AmÃ©liorer les scripts de gestion des serveurs MCP (Model Context Protocol) pour Ã©liminer les notifications d\u0027erreur au dÃ©marrage, optimiser le dÃ©marrage des serveurs et amÃ©liorer l\u0027expÃ©rience utilisateur.",
    "subTasks":  [

                 ],
    "parentId":  "",
    "files":  [

              ],
    "tags":  [

             ]
}
